<?xml version="1.0" encoding="UTF-8" standalone="no"?>
<!DOCTYPE woodwind SYSTEM "woodwind.dtd">
<woodwind description="Pearl flute PF-661 open hole">
  <embouchurehole>
    <radiusin>6.4</radiusin>
    <radiusout>5.7</radiusout>
    <length>4.4</length>
    <boreradius>8.533587786259544</boreradius>
  </embouchurehole>
  <upstream flange="-1.0">
    <bore>
      <radius1>8.533587786259544</radius1>
      <radius2>8.4</radius2>
      <length>17.5</length>
    </bore>
  </upstream>
  <downstream flange="0.1">
    <bore>
      <radius1>8.533587786259544</radius1>
      <radius2>9.4</radius2>
      <length>113.5</length>
    </bore>
    <bore>
      <radius1>9.4</radius1>
      <radius2>9.4</radius2>
      <length>37.0</length>
    </bore>
    <bore>
      <radius1>9.9</radius1>
      <radius2>9.9</radius2>
      <length>4.0</length>
    </bore>
    <bore>
      <radius1>9.5</radius1>
      <radius2>9.5</radius2>
      <length>46.2</length>
    </bore>
    <hole name="Tr1">
      <radius>3.7</radius>
      <length>1.9</length>
      <boreradius>9.5</boreradius>
      <key>
        <radius>6.5</radius>
        <holeradius>0.0</holeradius>
        <height>1.6</height>
        <thickness>3.6</thickness>
        <wallThickness>1.0</wallThickness>
        <chimneyHeight>1.5</chimneyHeight>
      </key>
    </hole>
    <bore>
      <radius1>9.5</radius1>
      <radius2>9.5</radius2>
      <length>17.3</length>
    </bore>
    <hole name="Tr2">
      <radius>3.9</radius>
      <length>1.9</length>
      <boreradius>9.5</boreradius>
      <key>
        <radius>6.5</radius>
        <holeradius>0.0</holeradius>
        <height>1.6</height>
        <thickness>3.6</thickness>
        <wallThickness>1.0</wallThickness>
        <chimneyHeight>1.5</chimneyHeight>
      </key>
    </hole>
    <bore>
      <radius1>9.5</radius1>
      <radius2>9.5</radius2>
      <length>16.4</length>
    </bore>
    <hole name="C#">
      <radius>3.5</radius>
      <length>1.9</length>
      <boreradius>9.5</boreradius>
      <key>
        <radius>6.5</radius>
        <holeradius>0.0</holeradius>
        <height>1.9</height>
        <thickness>3.6</thickness>
        <wallThickness>1.0</wallThickness>
        <chimneyHeight>1.5</chimneyHeight>
      </key>
    </hole>
    <bore>
      <radius1>9.5</radius1>
      <radius2>9.5</radius2>
      <length>32.5</length>
    </bore>
    <hole name="C">
      <radius>6.6</radius>
      <length>1.9</length>
      <boreradius>9.5</boreradius>
      <key>
        <radius>9.5</radius>
        <holeradius>0.0</holeradius>
        <height>2.6</height>
        <thickness>3.6</thickness>
        <wallThickness>1.0</wallThickness>
        <chimneyHeight>1.5</chimneyHeight>
      </key>
    </hole>
    <bore>
      <radius1>9.5</radius1>
      <radius2>9.5</radius2>
      <length>19.2</length>
    </bore>
    <hole name="B">
      <radius>6.6</radius>
      <length>1.9</length>
      <boreradius>9.5</boreradius>
      <key>
        <radius>9.5</radius>
        <holeradius>0.0</holeradius>
        <height>2.2</height>
        <thickness>4.0</thickness>
        <wallThickness>1.0</wallThickness>
        <chimneyHeight>1.5</chimneyHeight>
      </key>
    </hole>
    <bore>
      <radius1>9.5</radius1>
      <radius2>9.5</radius2>
      <length>21.0</length>
    </bore>
    <hole name="A#">
      <radius>6.6</radius>
      <length>1.9</length>
      <boreradius>9.5</boreradius>
      <key>
        <radius>9.5</radius>
        <holeradius>3.4</holeradius>
        <height>2.5</height>
        <thickness>4.2</thickness>
        <wallThickness>1.0</wallThickness>
        <chimneyHeight>1.5</chimneyHeight>
      </key>
    </hole>
    <bore>
      <radius1>9.5</radius1>
      <radius2>9.5</radius2>
      <length>23.2</length>
    </bore>
    <hole name="A">
      <radius>6.6</radius>
      <length>1.9</length>
      <boreradius>9.5</boreradius>
      <key>
        <radius>9.5</radius>
        <holeradius>3.4</holeradius>
        <height>2.4</height>
        <thickness>4.2</thickness>
        <wallThickness>1.0</wallThickness>
        <chimneyHeight>1.5</chimneyHeight>
      </key>
    </hole>
    <bore>
      <radius1>9.5</radius1>
      <radius2>9.5</radius2>
      <length>21.7</length>
    </bore>
    <hole name="G#">
      <radius>6.7</radius>
      <length>1.9</length>
      <boreradius>9.5</boreradius>
      <key>
        <radius>9.5</radius>
        <holeradius>0.0</holeradius>
        <height>2.4</height>
        <thickness>4.0</thickness>
        <wallThickness>1.0</wallThickness>
        <chimneyHeight>1.5</chimneyHeight>
      </key>
    </hole>
    <bore>
      <radius1>9.5</radius1>
      <radius2>9.5</radius2>
      <length>0.5</length>
    </bore>
    <hole name="G# dup.">
      <radius>6.7</radius>
      <length>1.9</length>
      <boreradius>9.5</boreradius>
      <key>
        <radius>9.5</radius>
        <holeradius>0.0</holeradius>
        <height>2.5</height>
        <thickness>4.0</thickness>
        <wallThickness>1.0</wallThickness>
        <chimneyHeight>1.5</chimneyHeight>
      </key>
    </hole>
    <bore>
      <radius1>9.5</radius1>
      <radius2>9.5</radius2>
      <length>24.4</length>
    </bore>
    <hole name="G">
      <radius>7.1</radius>
      <length>1.9</length>
      <boreradius>9.5</boreradius>
      <key>
        <radius>9.5</radius>
        <holeradius>0.0</holeradius>
        <height>2.1</height>
        <thickness>4.0</thickness>
        <wallThickness>1.0</wallThickness>
        <chimneyHeight>1.5</chimneyHeight>
      </key>
    </hole>
    <bore>
      <radius1>9.5</radius1>
      <radius2>9.5</radius2>
      <length>25.7</length>
    </bore>
    <hole name="F#">
      <radius>7.1</radius>
      <length>1.9</length>
      <boreradius>9.5</boreradius>
      <key>
        <radius>9.5</radius>
        <holeradius>3.4</holeradius>
        <height>2.3</height>
        <thickness>4.2</thickness>
        <wallThickness>1.0</wallThickness>
        <chimneyHeight>1.5</chimneyHeight>
      </key>
    </hole>
    <bore>
      <radius1>9.5</radius1>
      <radius2>9.5</radius2>
      <length>27.3</length>
    </bore>
    <hole name="F">
      <radius>7.1</radius>
      <length>1.9</length>
      <boreradius>9.5</boreradius>
      <key>
        <radius>9.5</radius>
        <holeradius>3.4</holeradius>
        <height>2.5</height>
        <thickness>4.2</thickness>
        <wallThickness>1.0</wallThickness>
        <chimneyHeight>1.5</chimneyHeight>
      </key>
    </hole>
    <bore>
      <radius1>9.5</radius1>
      <radius2>9.5</radius2>
      <length>28.8</length>
    </bore>
    <hole name="E">
      <radius>7.1</radius>
      <length>1.9</length>
      <boreradius>9.5</boreradius>
      <key>
        <radius>9.5</radius>
        <holeradius>3.4</holeradius>
        <height>2.4</height>
        <thickness>4.2</thickness>
        <wallThickness>1.0</wallThickness>
        <chimneyHeight>1.5</chimneyHeight>
      </key>
    </hole>
    <bore>
      <radius1>9.5</radius1>
      <radius2>9.5</radius2>
      <length>20.7</length>
    </bore>
    <bore>
      <radius1>9.5</radius1>
      <radius2>9.5</radius2>
      <length>10.9</length>
    </bore>
    <hole name="D#">
      <radius>7.7</radius>
      <length>1.9</length>
      <boreradius>9.5</boreradius>
      <key>
        <radius>10.3</radius>
        <holeradius>0.0</holeradius>
        <height>2.8</height>
        <thickness>4.0</thickness>
        <wallThickness>1.0</wallThickness>
        <chimneyHeight>1.5</chimneyHeight>
      </key>
    </hole>
    <bore>
      <radius1>9.5</radius1>
      <radius2>9.5</radius2>
      <length>34.0</length>
    </bore>
    <hole name="D">
      <radius>7.7</radius>
      <length>1.9</length>
      <boreradius>9.5</boreradius>
      <key>
        <radius>10.3</radius>
        <holeradius>0.0</holeradius>
        <height>2.8</height>
        <thickness>4.0</thickness>
        <wallThickness>1.0</wallThickness>
        <chimneyHeight>1.5</chimneyHeight>
      </key>
    </hole>
    <bore>
      <radius1>9.5</radius1>
      <radius2>9.5</radius2>
      <length>33.0</length>
    </bore>
    <hole name="C#">
      <radius>7.7</radius>
      <length>1.9</length>
      <boreradius>9.5</boreradius>
      <key>
        <radius>10.3</radius>
        <holeradius>0.0</holeradius>
        <height>2.8</height>
        <thickness>4.0</thickness>
        <wallThickness>1.0</wallThickness>
        <chimneyHeight>1.5</chimneyHeight>
      </key>
    </hole>
    <!-- Use this code for C foot -->
    <bore>
      <radius1>9.5</radius1>
      <radius2>9.5</radius2>
      <length>43.1</length>
    </bore>
    <!-- end of code for C foot -->
    <!-- Use this code for B foot -->
    <bore>
      <radius1>9.5</radius1>
      <radius2>9.5</radius2>
      <length>35.0</length>
    </bore>
    <hole name="C">
      <radius>7.7</radius>
      <length>1.9</length>
      <boreradius>9.5</boreradius>
      <key>
        <radius>10.3</radius>
        <holeradius>0.0</holeradius>
        <height>2.8</height>
        <thickness>4.0</thickness>
        <wallThickness>1.0</wallThickness>
        <chimneyHeight>1.5</chimneyHeight>
      </key>
    </hole>
    <bore>
      <radius1>9.5</radius1>
      <radius2>9.5</radius2>
      <length>41.0</length>
    </bore>
    <!-- end of code for B foot -->
  </downstream>
</woodwind>
