<?xml version="1.0" encoding="UTF-8" standalone="no"?>
<!DOCTYPE woodwind SYSTEM "woodwind.dtd">
<woodwind description="McGee classical flute">
  <embouchurehole>
    <radiusin>5.7</radiusin>
    <radiusout>5.5</radiusout>
    <length>3.5</length>
    <boreradius>9.5</boreradius>
  </embouchurehole>
  <upstream flange="-1.0">
    <bore>
      <radius1>9.5</radius1>
      <radius2>9.5</radius2>
      <length>19.0</length>
    </bore>
  </upstream>
  <downstream flange="0.75">
    <bore>
      <radius1>9.5</radius1>
      <radius2>9.5</radius2>
      <length>139.5</length>
    </bore>
    <bore>
      <radius1>10.0</radius1>
      <radius2>10.0</radius2>
      <length>12.8</length>
    </bore>
    <bore>
      <radius1>9.5</radius1>
      <radius2>9.2</radius2>
      <length>2.0</length>
    </bore>
    <bore>
      <radius1>9.2</radius1>
      <radius2>8.6</radius2>
      <length>83.5</length>
    </bore>
    <hole name="L1">
      <radius>4.0</radius>
      <length>4.8</length>
      <boreradius>8.6</boreradius>
    </hole>
    <bore>
      <radius1>8.6</radius1>
      <radius2>8.412073490813647</radius2>
      <length>17.9</length>
    </bore>
    <hole name="C">
      <radius>3.2</radius>
      <length>4.5</length>
      <boreradius>8.412073490813647</boreradius>
      <key>
        <radius>6.7</radius>
        <holeradius>0.0</holeradius>
        <height>4.0</height>
        <thickness>4.0</thickness>
        <wallThickness>3.0</wallThickness>
        <chimneyHeight>0.0</chimneyHeight>
      </key>
    </hole>
    <bore>
      <radius1>8.412073490813647</radius1>
      <radius2>8.2</radius2>
      <length>20.2</length>
    </bore>
    <hole name="L2">
      <radius>5.1</radius>
      <length>4.9</length>
      <boreradius>8.2</boreradius>
    </hole>
    <bore>
      <radius1>8.2</radius1>
      <radius2>8.032743362831859</radius2>
      <length>18.9</length>
    </bore>
    <hole name="Bb">
      <radius>3.0</radius>
      <length>4.5</length>
      <boreradius>8.032743362831859</boreradius>
      <key>
        <radius>5.7</radius>
        <holeradius>0.0</holeradius>
        <height>2.0</height>
        <thickness>2.5</thickness>
        <wallThickness>3.0</wallThickness>
        <chimneyHeight>0.0</chimneyHeight>
      </key>
    </hole>
    <bore>
      <radius1>8.032743362831859</radius1>
      <radius2>7.9</radius2>
      <length>15.0</length>
    </bore>
    <hole name="L3">
      <radius>4.0</radius>
      <length>5.0</length>
      <boreradius>7.9</boreradius>
    </hole>
    <bore>
      <radius1>7.9</radius1>
      <radius2>7.665720081135903</radius2>
      <length>23.1</length>
    </bore>
    <hole name="G#">
      <radius>3.0</radius>
      <length>4.5</length>
      <boreradius>7.665720081135903</boreradius>
      <key>
        <radius>6.0</radius>
        <holeradius>0.0</holeradius>
        <height>2.7</height>
        <thickness>3.0</thickness>
        <wallThickness>3.0</wallThickness>
        <chimneyHeight>0.0</chimneyHeight>
      </key>
    </hole>
    <bore>
      <radius1>7.665720081135903</radius1>
      <radius2>7.4</radius2>
      <length>26.2</length>
    </bore>
    <bore>
      <radius1>7.5</radius1>
      <radius2>7.4</radius2>
      <length>8.6</length>
    </bore>
    <hole name="R1">
      <radius>4.8</radius>
      <length>5.1</length>
      <boreradius>7.4</boreradius>
    </hole>
    <bore>
      <radius1>7.4</radius1>
      <radius2>7.1</radius2>
      <length>31.0</length>
    </bore>
    <hole name="R2">
      <radius>5.5</radius>
      <length>5.0</length>
      <boreradius>7.1</boreradius>
    </hole>
    <bore>
      <radius1>7.1</radius1>
      <radius2>6.8</radius2>
      <length>20.4</length>
    </bore>
    <hole name="F">
      <radius>4.0</radius>
      <length>4.5</length>
      <boreradius>6.8</boreradius>
      <key>
        <radius>6.7</radius>
        <holeradius>0.0</holeradius>
        <height>1.9</height>
        <thickness>4.0</thickness>
        <wallThickness>3.0</wallThickness>
        <chimneyHeight>0.0</chimneyHeight>
      </key>
    </hole>
    <bore>
      <radius1>6.8</radius1>
      <radius2>6.8</radius2>
      <length>15.5</length>
    </bore>
    <hole name="R3">
      <radius>3.3</radius>
      <length>5.2</length>
      <boreradius>6.8</boreradius>
    </hole>
    <bore>
      <radius1>6.8</radius1>
      <radius2>6.6</radius2>
      <length>35.4</length>
    </bore>
    <bore>
      <radius1>6.8</radius1>
      <radius2>6.8</radius2>
      <length>52.3</length>
    </bore>
    <hole name="C#">
      <radius>6.5</radius>
      <length>5.1</length>
      <boreradius>6.8</boreradius>
    </hole>
    <bore>
      <radius1>6.8</radius1>
      <radius2>6.7</radius2>
      <length>36.7</length>
    </bore>
    <hole name="C">
      <radius>5.2</radius>
      <length>5.0</length>
      <boreradius>6.7</boreradius>
    </hole>
    <bore>
      <radius1>6.7</radius1>
      <radius2>6.7</radius2>
      <length>39.2</length>
    </bore>
  </downstream>
</woodwind>
